评论	评论时间	笔记标题	笔记链接	用户名	IP属地	笔记内容
哈哈哈哈哈哈一定会的宝！！到时候做5只根本戴不完	2024/3/25	铲屎官夫妇说想要两只猫咪一起参加婚礼	https://www.xiaohongshu.com/explore/65fd3812000000001203e75e	婚礼策划师安安Anan	广东	可可爱爱的铲屎官夫妇的婚礼还有他们最爱的小猫咪也来啦～婚礼融入了猫咪的元素都开始变得可爱起来啦#森系婚礼 #猫猫主题婚礼 #深圳婚礼 #户外婚礼 #小众婚礼 #参加婚礼 #我的走心婚礼 #婚礼布置 #婚礼灵感
谢谢[飞吻R]	2024/3/22	午后阳光的氛围感绝了??｜深圳跟拍	https://www.xiaohongshu.com/explore/65fd0d4e0000000012032d9e	女摄羔羊雅（接亲领证跟拍）	广东	拍摄设备：佳能6D镜头：70-200，35定焦、24-105佳能镜头/拍照地点：从园博园的东门进去，一直走分叉路口往右边走、然后走到南苑位置开拍～/注意??点：可以选择下午三点左右去，到那里差不多3点半到4点左右的光线拍照也挺好看的，微黄色的胶片风???。_????还有去园博园最重要的一点就是记得带花露水，防??叮咬。我用的那款真的很好用，每次户外拍摄我都会带。_对了～忘记自我介绍啦[偷笑R]，我是来自湖南株洲的深圳女摄，目前专拍领证跟拍和接亲跟拍（活动跟拍、结婚、恋爱纪念跟拍……我也拍，有单来者不拒哈哈哈哈哈哈）/好看的照片服装搭配也必不可少??，深圳备婚的姐妹们可以根据自己的喜好来选择适合的服装，拍出来的照片才更好看～，黑白配是个经典风格，跟场地风格百搭，怎么样都不会出错！_拍摄前期我会沟通拍摄场地、风格、服装、妆容……根据这些来调整拍摄风格，我比较喜欢抓拍下的情绪记录??，会引导、会给你们情景设定然后我来抓，也会动作指导（不过我更喜欢是记录你们自然生活状态下的照片[哇R]）/3???少量档期可定、4???档期开启??预定啦还有更多可以看看??我的主页啦/#令人心动的爱情瞬间 #婚礼纪实 #中式户外 #民国风婚纱照 #一张照片高级感 #复古民国风 #客片分享 #旗袍婚纱照 #深圳领证跟拍 #深圳备婚
我也好喜欢[飞吻R]～我还拍了一组胶片???的，这个是单反拍的，等晚点发～	2024/3/22	午后阳光的氛围感绝了??｜深圳跟拍	https://www.xiaohongshu.com/explore/65fd0d4e0000000012032d9e	女摄羔羊雅（接亲领证跟拍）	广东	拍摄设备：佳能6D镜头：70-200，35定焦、24-105佳能镜头/拍照地点：从园博园的东门进去，一直走分叉路口往右边走、然后走到南苑位置开拍～/注意??点：可以选择下午三点左右去，到那里差不多3点半到4点左右的光线拍照也挺好看的，微黄色的胶片风???。_????还有去园博园最重要的一点就是记得带花露水，防??叮咬。我用的那款真的很好用，每次户外拍摄我都会带。_对了～忘记自我介绍啦[偷笑R]，我是来自湖南株洲的深圳女摄，目前专拍领证跟拍和接亲跟拍（活动跟拍、结婚、恋爱纪念跟拍……我也拍，有单来者不拒哈哈哈哈哈哈）/好看的照片服装搭配也必不可少??，深圳备婚的姐妹们可以根据自己的喜好来选择适合的服装，拍出来的照片才更好看～，黑白配是个经典风格，跟场地风格百搭，怎么样都不会出错！_拍摄前期我会沟通拍摄场地、风格、服装、妆容……根据这些来调整拍摄风格，我比较喜欢抓拍下的情绪记录??，会引导、会给你们情景设定然后我来抓，也会动作指导（不过我更喜欢是记录你们自然生活状态下的照片[哇R]）/3???少量档期可定、4???档期开启??预定啦还有更多可以看看??我的主页啦/#令人心动的爱情瞬间 #婚礼纪实 #中式户外 #民国风婚纱照 #一张照片高级感 #复古民国风 #客片分享 #旗袍婚纱照 #深圳领证跟拍 #深圳备婚
那是！我赞同！ 哈哈哈哈哈[害羞R][害羞R][害羞R]	2024/3/22	发婚礼请帖时，统一来宾们的着装颜色呀??	https://www.xiaohongshu.com/explore/65fcf68d0000000012032309	摄影师 星星的星	广东	如果可以的话，办户外婚礼的时候建议统一一下宾客们的服装色系，这样整场婚礼会更加有仪式感&有意义哦～ 如果你的婚礼有某种特定主题或色系，也可以把“dress code”主题写在你的婚礼请柬上哦～ 这样来宾服装的风格或者颜色，来与婚礼的风格和色调会有呼应。（?Dress code指的是着装规定，这在国外的派对、婚礼上十分常见，备婚过于复杂，很多新人会忽视这一点，其实有了 dress code，可以大大提升婚礼氛围哦~）原因有如下：??营造整体氛围：统一的服装颜色可以让整个婚礼现场看起来更加整洁、和谐，营造出一种独特的氛围。??突出主题：如果新人有特别的婚礼主题，例如某种颜色或风格，要求宾客穿着相应颜色的服装可以更好地突出主题。??拍照效果：统一服装颜色会让照片更加美观，也更容易拍出有特色的集体照。??方便宾客：对于一些不太擅长搭配服装的宾客来说，统一颜色可以让他们更容易选择合适的服装。??体现仪式感：这种要求可以让宾客更加投入到婚礼的氛围中，增强仪式感。当然，是否要求宾客统一服装颜色完全取决于新人的个人喜好和婚礼的整体策划。在实际执行中，还是要需要考虑宾客的接受程度和年龄范围，比较适用于少人一点的户外婚礼~ [哇R]你参加过要求统一服装颜色的婚礼吗？.#广州婚礼跟拍 #深圳婚礼跟拍 #佛山婚礼跟拍#我的走心婚礼 #胶片婚礼 #户外婚礼 #婚礼攻略
[飞吻R][飞吻R][飞吻R][飞吻R][飞吻R][飞吻R]	2024/3/22	发婚礼请帖时，统一来宾们的着装颜色呀??	https://www.xiaohongshu.com/explore/65fcf68d0000000012032309	摄影师 星星的星	广东	如果可以的话，办户外婚礼的时候建议统一一下宾客们的服装色系，这样整场婚礼会更加有仪式感&有意义哦～ 如果你的婚礼有某种特定主题或色系，也可以把“dress code”主题写在你的婚礼请柬上哦～ 这样来宾服装的风格或者颜色，来与婚礼的风格和色调会有呼应。（?Dress code指的是着装规定，这在国外的派对、婚礼上十分常见，备婚过于复杂，很多新人会忽视这一点，其实有了 dress code，可以大大提升婚礼氛围哦~）原因有如下：??营造整体氛围：统一的服装颜色可以让整个婚礼现场看起来更加整洁、和谐，营造出一种独特的氛围。??突出主题：如果新人有特别的婚礼主题，例如某种颜色或风格，要求宾客穿着相应颜色的服装可以更好地突出主题。??拍照效果：统一服装颜色会让照片更加美观，也更容易拍出有特色的集体照。??方便宾客：对于一些不太擅长搭配服装的宾客来说，统一颜色可以让他们更容易选择合适的服装。??体现仪式感：这种要求可以让宾客更加投入到婚礼的氛围中，增强仪式感。当然，是否要求宾客统一服装颜色完全取决于新人的个人喜好和婚礼的整体策划。在实际执行中，还是要需要考虑宾客的接受程度和年龄范围，比较适用于少人一点的户外婚礼~ [哇R]你参加过要求统一服装颜色的婚礼吗？.#广州婚礼跟拍 #深圳婚礼跟拍 #佛山婚礼跟拍#我的走心婚礼 #胶片婚礼 #户外婚礼 #婚礼攻略
你好，有的呀	2024/3/22	户外婚礼主持作品《三十而遇》	https://www.xiaohongshu.com/explore/65fcf67b000000000d00ed72	婚礼主持 高翔	广东	三十岁，是人生的一道分水岭。他们恰好在而立之年相遇，该来的人总会来，请耐心等待。雨中的婚礼，有独特的浪漫和氛围，投入其中，你会读懂这份美～#深圳婚礼 #深圳婚礼主持人 #惠州婚礼 #惠州婚礼主持人#东莞婚礼主持人 #户外婚礼 #雨天婚礼 #婚礼现场 #婚礼
真假参哦	2024/3/24	《怦然心动》同款大树下的婚礼	https://www.xiaohongshu.com/explore/65fce672000000001203201a	策划师Anan 小助理	广东	在春天让我们在大树下结个婚吧～
[偷笑R][偷笑R]	2024/3/22	户外婚礼的玩趣	https://www.xiaohongshu.com/explore/65fc4d3d000000000d00d951	山芈婚礼	广东	#一头扎进春天里 #户外婚礼 #小众婚礼 #户外 #享受这悠闲时光 #深圳婚礼 #真实婚礼 #小预算婚礼
[耶R]	2024/3/23	户外草坪婚礼|小众婚礼的美懂吗	https://www.xiaohongshu.com/explore/65fc3fa20000000012030b35	绘梦人婚礼 有情怀的策划	广东	一场不要太美丽的婚礼现场，小场地，出大片爱了！爱了！#户外婚礼#草坪婚礼#白绿小清新婚礼#深圳婚礼#登喜路国际大酒店 草坪婚礼#绘梦人婚礼策划
左边那只位置不对，再画了一次[捂脸R]	2024/3/22	在东莞・婚礼现场绘画 | ??新郎&??新娘	https://www.xiaohongshu.com/explore/65fbfa170000000012021383	婚礼画师??cc	广东	今天又是一对从校园到现在的恋爱新人和他们的婚礼布置一样，都很可爱[吧唧R]他们说“晚宴是给家人的，婚礼??应该是给我们自己的”，所以当然怎么开心怎么来！穿上圆滚滚的充气服，也被我用简笔画的形式记录下来了（无奖寻找成品[偷笑R]）第一次去东莞[大笑R]体验挺新奇的我对天气的温度似乎掌握得不太好，出门衬衫??加针织裙一到现场实在是太热了[捂脸R]美团赶紧下单了一条裤子和手机支架（手机支架也落在顺风车上了从酒店厕所换好出来就有个女老板形象的大姐姐严肃地问我什么什么餐厅在哪[汗颜R]我只能说我不是工作人员，因为我的形象真的太像工作人员了赶紧把袖子挽起来，衬衫前面打个结[笑哭R]看起来休闲一点对了，这个酒店有好多放养的孔雀??[哇R]除了在彝酃斫校飞上屋顶的样子还是很帅的（就在头顶上）拍到一只就在婚礼现场旁边的??好奇旁边的月子中心里面的????????觉得还好吗 哈哈最开始看东莞天气是28度+下雨???，虽然还没到下开水的程度[偷笑R]但这个配置就是妥妥的潮湿[石化R]上一次颜料干不了画得难受的现场还历历在目所以提前把底色给打好！画的那两天天也真的在回南了，还得用风扇吹一吹[偷笑R]有时候画画就喜欢慢慢来，所以这次底色铺得很放松慢慢地刷啊，摆啊，点啊，戳啊，勾线，过程非常治愈??朱迪和??尼克为了画得更准更精致，也提前带上了[暗中观察R]
[偷笑R]	2024/3/21	在东莞・婚礼现场绘画 | ??新郎&??新娘	https://www.xiaohongshu.com/explore/65fbfa170000000012021383	婚礼画师??cc	广东	今天又是一对从校园到现在的恋爱新人和他们的婚礼布置一样，都很可爱[吧唧R]他们说“晚宴是给家人的，婚礼??应该是给我们自己的”，所以当然怎么开心怎么来！穿上圆滚滚的充气服，也被我用简笔画的形式记录下来了（无奖寻找成品[偷笑R]）第一次去东莞[大笑R]体验挺新奇的我对天气的温度似乎掌握得不太好，出门衬衫??加针织裙一到现场实在是太热了[捂脸R]美团赶紧下单了一条裤子和手机支架（手机支架也落在顺风车上了从酒店厕所换好出来就有个女老板形象的大姐姐严肃地问我什么什么餐厅在哪[汗颜R]我只能说我不是工作人员，因为我的形象真的太像工作人员了赶紧把袖子挽起来，衬衫前面打个结[笑哭R]看起来休闲一点对了，这个酒店有好多放养的孔雀??[哇R]除了在彝酃斫校飞上屋顶的样子还是很帅的（就在头顶上）拍到一只就在婚礼现场旁边的??好奇旁边的月子中心里面的????????觉得还好吗 哈哈最开始看东莞天气是28度+下雨???，虽然还没到下开水的程度[偷笑R]但这个配置就是妥妥的潮湿[石化R]上一次颜料干不了画得难受的现场还历历在目所以提前把底色给打好！画的那两天天也真的在回南了，还得用风扇吹一吹[偷笑R]有时候画画就喜欢慢慢来，所以这次底色铺得很放松慢慢地刷啊，摆啊，点啊，戳啊，勾线，过程非常治愈??朱迪和??尼克为了画得更准更精致，也提前带上了[暗中观察R]
嗨  丝信 您了哈！[害羞R] 看看信息！	2024/3/21	别再犹豫 |这就是你梦寐以求的婚礼场地	https://www.xiaohongshu.com/explore/65fb02990000000012021e20	YoYo 婚礼宴会	广东	.婚礼 | 备婚 | 婚礼酒店 | 婚宴场地 | 深圳婚宴.[偷笑R]观澜格兰云天[赞R]坐标:观澜大道环观南路.[哇R]餐标：4999-11999元/桌.[飞吻R]场地介绍:[自拍R]大宴会厅:层高6m，可容纳58桌，无柱[飞吻R]西式宴会厅:可容纳20桌，无柱[自拍R]多功能:层高4m，可容纳18桌，无柱[飞吻R]太极大厅:层高3.5m，可容纳34桌，2柱[自拍R]2000平方米户外场地.推荐原因：酒店归属于格兰云天集团麾下[哇R]作为本土的五星级酒店翘楚[自拍R]其外观设计宛如一朵盛开的莲花[飞吻R]尽显出一种超凡脱俗的雅致与美感[偷笑R]酒店坐落于风景秀丽的龙华新区[色色R]紧邻著名的观澜湖高尔夫球会[哇R]充满艺术气息的观澜版画村以及山水田园旅游文化园[自拍R]四周环绕着丰富的旅游资源[偷笑R]为宾客提供了得天独厚的休闲度假环境。.[喝奶茶R]小编还整理了深圳各区热门婚宴酒店价格，有想了解的场地可以丝信我！.[一R]《南山区婚宴酒店》合集[樱花R][二R]《龙岗区婚宴酒店》合集[星R][三R]《罗湖区婚宴酒店》合集[福R][四R]《盐田区婚宴酒店》合集[樱花R][五R]《宝安区婚宴酒店》合集[星R][六R]《福田区婚宴酒店》合集[鞭炮R].
[害羞R][害羞R][害羞R][害羞R]	2024/3/21	珠帘绣幕蔼祥烟 合嘉盟缔百年 | 正好影像	https://www.xiaohongshu.com/explore/65fc24ad000000000d00e99c	正好影像社禁言中私信不回	广东	正好影像社婚礼客片分享    #  #
私您	2024/3/22	广州增城春天户外婚礼太生机盎然了	https://www.xiaohongshu.com/explore/65fbfd30000000001203fb3e	SurpriseVision思派视觉	广东	春天的婚礼 百看不厌-
[飞吻R][飞吻R]	2024/3/22	宾客来参加婚礼发朋友圈被赞爆的婚礼！	https://www.xiaohongshu.com/explore/65fbec920000000012032973	Autumn秋秋（孕晚期版）	广东	户外海边婚礼游园会get！婚礼游戏都玩什么？一直都不喜欢非常堂皇隆重的婚礼，希望是轻松的 愉快的 自由的 婚礼，于是最终找了策划公司敲定【婚礼游园会】婚礼游园会都玩什么游戏项目？1.入场券抽奖???2.投壶游戏??3.刮刮彩票???4.套圈圈??5.拍立得???6.扎气球???7.取名字?????8.油画师??户外婚礼晚宴After party请了乐队，音乐使得整个场子都很嗨，每位宾客都起来互动了，一场玩下来就是又开心又累，人生特殊的体验！烟花伴随着乐队缓缓升起，那一刻觉得这辈子，值了！婚礼结束后朋友都反馈婚礼办的很好，甚至他的朋友圈被点爆了，为此感到荣幸，我们开心，大家也开心！
场地｜喜来登度假酒店化妆｜依萌造型司仪｜立团队乐队｜制燥乐队摄影｜影工坊秘书｜艺萱策划｜圆梦	2024/3/21	宾客来参加婚礼发朋友圈被赞爆的婚礼！	https://www.xiaohongshu.com/explore/65fbec920000000012032973	Autumn秋秋（孕晚期版）	广东	户外海边婚礼游园会get！婚礼游戏都玩什么？一直都不喜欢非常堂皇隆重的婚礼，希望是轻松的 愉快的 自由的 婚礼，于是最终找了策划公司敲定【婚礼游园会】婚礼游园会都玩什么游戏项目？1.入场券抽奖???2.投壶游戏??3.刮刮彩票???4.套圈圈??5.拍立得???6.扎气球???7.取名字?????8.油画师??户外婚礼晚宴After party请了乐队，音乐使得整个场子都很嗨，每位宾客都起来互动了，一场玩下来就是又开心又累，人生特殊的体验！烟花伴随着乐队缓缓升起，那一刻觉得这辈子，值了！婚礼结束后朋友都反馈婚礼办的很好，甚至他的朋友圈被点爆了，为此感到荣幸，我们开心，大家也开心！
[飞吻R][飞吻R][飞吻R]	2024/3/21	宾客来参加婚礼发朋友圈被赞爆的婚礼！	https://www.xiaohongshu.com/explore/65fbec920000000012032973	Autumn秋秋（孕晚期版）	广东	户外海边婚礼游园会get！婚礼游戏都玩什么？一直都不喜欢非常堂皇隆重的婚礼，希望是轻松的 愉快的 自由的 婚礼，于是最终找了策划公司敲定【婚礼游园会】婚礼游园会都玩什么游戏项目？1.入场券抽奖???2.投壶游戏??3.刮刮彩票???4.套圈圈??5.拍立得???6.扎气球???7.取名字?????8.油画师??户外婚礼晚宴After party请了乐队，音乐使得整个场子都很嗨，每位宾客都起来互动了，一场玩下来就是又开心又累，人生特殊的体验！烟花伴随着乐队缓缓升起，那一刻觉得这辈子，值了！婚礼结束后朋友都反馈婚礼办的很好，甚至他的朋友圈被点爆了，为此感到荣幸，我们开心，大家也开心！
[飞吻R][飞吻R][飞吻R]	2024/3/21	宾客来参加婚礼发朋友圈被赞爆的婚礼！	https://www.xiaohongshu.com/explore/65fbec920000000012032973	Autumn秋秋（孕晚期版）	广东	户外海边婚礼游园会get！婚礼游戏都玩什么？一直都不喜欢非常堂皇隆重的婚礼，希望是轻松的 愉快的 自由的 婚礼，于是最终找了策划公司敲定【婚礼游园会】婚礼游园会都玩什么游戏项目？1.入场券抽奖???2.投壶游戏??3.刮刮彩票???4.套圈圈??5.拍立得???6.扎气球???7.取名字?????8.油画师??户外婚礼晚宴After party请了乐队，音乐使得整个场子都很嗨，每位宾客都起来互动了，一场玩下来就是又开心又累，人生特殊的体验！烟花伴随着乐队缓缓升起，那一刻觉得这辈子，值了！婚礼结束后朋友都反馈婚礼办的很好，甚至他的朋友圈被点爆了，为此感到荣幸，我们开心，大家也开心！
好的s老师	2024/3/22	户外婚礼这个小摊绝了，好多宾客排队等待	https://www.xiaohongshu.com/explore/65fbe9c80000000012030712	诗与远方婚礼定制	广东	相信我，户外婚礼这个调酒环节真的值得拥有，好多宾客在现场排队点单一人一杯莫吉托，喝完这杯再来一杯策划:#诗与远方文化传播酒店:#深圳佳兆业万豪酒店#深圳小众婚礼#深圳小众婚礼策划#深圳小众婚礼布置#深圳小众婚礼场地#深圳小众婚礼设计#深圳婚礼策划#深圳婚礼#深圳婚礼策划推荐#深圳婚礼策划师#深圳独立婚礼策划师#深圳小型婚礼#深圳小型婚礼场地#深圳小型婚礼策划#深圳小型婚礼布置#户外婚礼#户外婚礼记录#户外婚礼甜品台#深圳婚礼调酒#婚礼调酒师#婚礼调酒台#深圳草坪婚礼#深圳草坪婚礼策划#深圳草坪婚礼场地#深圳草坪婚礼布置#深圳海边婚礼#深圳海边婚礼策划#深圳海边婚礼场地#深圳海边婚礼布置#佳兆业万豪#佳兆业万豪酒店婚礼#诗与远方#诗与远方婚礼策划
劈	2024/3/21	户外婚礼这个小摊绝了，好多宾客排队等待	https://www.xiaohongshu.com/explore/65fbe9c80000000012030712	诗与远方婚礼定制	广东	相信我，户外婚礼这个调酒环节真的值得拥有，好多宾客在现场排队点单一人一杯莫吉托，喝完这杯再来一杯策划:#诗与远方文化传播酒店:#深圳佳兆业万豪酒店#深圳小众婚礼#深圳小众婚礼策划#深圳小众婚礼布置#深圳小众婚礼场地#深圳小众婚礼设计#深圳婚礼策划#深圳婚礼#深圳婚礼策划推荐#深圳婚礼策划师#深圳独立婚礼策划师#深圳小型婚礼#深圳小型婚礼场地#深圳小型婚礼策划#深圳小型婚礼布置#户外婚礼#户外婚礼记录#户外婚礼甜品台#深圳婚礼调酒#婚礼调酒师#婚礼调酒台#深圳草坪婚礼#深圳草坪婚礼策划#深圳草坪婚礼场地#深圳草坪婚礼布置#深圳海边婚礼#深圳海边婚礼策划#深圳海边婚礼场地#深圳海边婚礼布置#佳兆业万豪#佳兆业万豪酒店婚礼#诗与远方#诗与远方婚礼策划
来咯来咯[飞吻R]	2024/3/23	还是选择了这??深圳跑了N家才选定的场地	https://www.xiaohongshu.com/explore/65fbdcd5000000000d00e5db	RM罗曼公馆	广东	??分享场婚礼策划师自己的婚礼场地.开放式场地布局，给予婚礼更多可能性松软翠绿的宽阔草坪被绿植??环绕日影婆娑之中，构筑个沉浸式自然之境轻松解锁舒适自然??的私享婚礼美学.纯净简约的建筑融于树林花园间层层递进，又不失分寸复合多功能的多元化空间增加私密性同时，又给足安全度和舒适性全方位满足客户所需.??地址：深圳龙华区??店名：罗曼公馆.?? 扣【1】小编，一键获取全新报价
谢谢哈哈哈哈	2024/3/21	摄影师总结｜户外婚礼要怎么筹备才能出片？	https://www.xiaohongshu.com/explore/65fbd9dd00000000120374a9	摄影师 星星的星	广东	??很多姐妹想办户外婚礼，但总是担心效果不好，也不知道怎样挑选服装才能更出片，星星帮大家总结了2点，看完就知道怎么筹备啦！??户外婚礼出片好看&高级的2个重点：1.婚礼场地环境好/草坪质量好，背景统一不穿帮。2.婚纱款式简约轻便，宾客们dress code同一色系。展开说说：??草坪环境好这个很好理解，草地平整，不要坑坑洼洼的，不然穿高跟鞋走路会很难走，比较优质的户外婚礼场地草坪都是有专人打理维护的，还有就是背景不要建筑物穿帮会更加分哦。??婚纱选择轻婚纱蕞佳，避免户外婚礼选择blingbling的主纱，不然裙摆太长&太重会非常损耗体力，而且在草坪拍出来也不好看，选择缎面或者比较细腻的面料，款式选择简约款或者是比较有设计感的款式很nice，无拖尾或者是小拖尾都非常适合。??婚礼邀请上提醒宾客们dress code，可以提前想好婚礼布置会出现的颜色，让大家配合一下服装色系，这样拍照呈现的效果也会棒！随手一拍都是色调和谐的画面。-蕞后，选择摄影师也非常非常的重要，风格合拍、输出稳定都需要重点看哦，千万不能只看价格～?我是摄影师星星，经常会分享一些从摄影师角度出发的总结小经验～欢迎常来看哦～??:@摄影师 星星的星
谢谢包子[飞吻R]	2024/3/22	摄影师总结｜户外婚礼要怎么筹备才能出片？	https://www.xiaohongshu.com/explore/65fbd9dd00000000120374a9	摄影师 星星的星	广东	??很多姐妹想办户外婚礼，但总是担心效果不好，也不知道怎样挑选服装才能更出片，星星帮大家总结了2点，看完就知道怎么筹备啦！??户外婚礼出片好看&高级的2个重点：1.婚礼场地环境好/草坪质量好，背景统一不穿帮。2.婚纱款式简约轻便，宾客们dress code同一色系。展开说说：??草坪环境好这个很好理解，草地平整，不要坑坑洼洼的，不然穿高跟鞋走路会很难走，比较优质的户外婚礼场地草坪都是有专人打理维护的，还有就是背景不要建筑物穿帮会更加分哦。??婚纱选择轻婚纱蕞佳，避免户外婚礼选择blingbling的主纱，不然裙摆太长&太重会非常损耗体力，而且在草坪拍出来也不好看，选择缎面或者比较细腻的面料，款式选择简约款或者是比较有设计感的款式很nice，无拖尾或者是小拖尾都非常适合。??婚礼邀请上提醒宾客们dress code，可以提前想好婚礼布置会出现的颜色，让大家配合一下服装色系，这样拍照呈现的效果也会棒！随手一拍都是色调和谐的画面。-蕞后，选择摄影师也非常非常的重要，风格合拍、输出稳定都需要重点看哦，千万不能只看价格～?我是摄影师星星，经常会分享一些从摄影师角度出发的总结小经验～欢迎常来看哦～??:@摄影师 星星的星
