评论	评论时间	笔记标题	笔记链接	用户名	IP属地	笔记内容
[飞吻R]	2024/3/25	有趣的婚礼的秘密在于..这些大大的‘小心思’	https://www.xiaohongshu.com/explore/65faa2bf0000000012022fbf	婚礼策划Virginia	广东	互动1???大合照签名牌来宾到达现场，在相册边签上自己的个性签名，婚礼结束后，将婚礼上少不了的大合照放在中间。来宾的名字围绕着当天的大合照，是当天婚礼的见证印迹，也是给新人的祝福和礼物，婚礼结束，新人就将这一份满满祝福带回家作为纪念?????互动2??婚礼纹身贴来宾选取一张喜欢的婚礼Slogan???贴在手臂展示，作为这场婚礼特别的参与者，表达自己对新人的特别的祝福之外?，关键！！！拍照也好好看呀~~~?????互动3??DIY扩香伴手礼。在香料区，根据喜爱的颜色，抓一把扩香石?喜欢的香味???，创造一个属于当天婚礼的味道，留住当天美好记忆。也作为新人给来宾的伴手礼，让来宾参与感满满！互动4??：?麻将席位卡。爱打麻将的看到都想拉着领座来个对对碰！将麻将和席位卡结合，来宾到达后，找到属于自己的?????，找到属于自己的位置～????在婚礼上给来宾不经意的创意互动，是新人对于来宾到场的感谢，对于来宾，也是具深刻记忆的体验哦，你觉得呢？~#超有爱婚礼策划?#来回KITCHEN?#婚礼场地?#广州婚礼?#室内婚礼?#婚礼?#仓库婚礼?#婚礼互动?#婚礼签到?#创意签到?#互动签到?#浪漫生活的记录者?#婚礼花艺?#婚礼布置?#广州婚礼布置?#小众婚礼?#创意婚礼??#我的走心婚礼?#婚礼灵感?#真实婚礼?#婚礼现场@视频薯 ?@生活薯
有呀	2024/3/24	终于有人把广州婚宴酒店和菜单价格说明白了	https://www.xiaohongshu.com/explore/65f9840c000000000d00d9fe	小宴婚宴预定	广东	2024年广州婚礼场地如何选？??宴哥整理了一期适配所有备婚小白的广州婚宴酒店攻略????，一图就能看懂！有需要的赶紧?+?，以防走丢~・????先了解自己倾向的区域有哪些酒店????再从预算里找到合适的，简单快速省时间越秀、荔湾、天河、白云、番禺……从性价比到轻奢都涵盖到了，图2-4有详细记录笔记篇幅有限，没写到的区域下期再更新啦~・?????♀宴哥可提供：? 查询广州婚宴酒店档期? 了解广州婚宴场地详细信息? 获取广州各区域婚宴酒店? 获取广州各类型婚礼场地? ??广州婚宴菜单近期报??・价格信息有时效性，看上请速去厚苔DD喜欢宴哥的分享，记得Guan??哦~想看更多场地信息，评论区留言・#婚礼 #广州婚礼 #广州婚宴 #广州酒店推荐 #广州户外 #广州草坪 #广州婚礼酒店 #广州五星级酒店 #广州一站式婚礼 #广州性价比婚礼 #广州小预算婚礼
好的亲，看看丝芯哦	2024/3/22	哭了，这真的是普通人可以拥有的婚礼吗！	https://www.xiaohongshu.com/explore/65f9678200000000120235d9	美悦盛宴婚礼艺术中心	广东	“娶到心爱的女孩，像打了一场胜仗”??今天分享的这场婚礼，不仅现场美到了我心巴上??新娘的出片率也把我惊艳到了??・??婚礼主题：<深海秘境>海洋主题婚礼??婚礼风格：梦幻 童话 海洋风・接亲作为婚礼当天的第一个环节必须狠狠记录起来??有镜头尴尬症的宝贝们可以参考这位新娘的拍照姿势再配上一些辅助道具??出片率简直不要太高・婚宴在亚特兰蒂斯深海秘境厅进行融入蓝鲸、水母、城堡与珊瑚等元素??营造出梦境与现实交错的氛围新郎牵起新娘手的瞬间宛如一位打了胜仗的勇士??这一刻 幸福的感觉被具象化当深海奏鸣曲响起?海神波塞冬将对他们施下幸福的魔法??・最后~想和伴郎伴娘拍大合照的宝子，一定要记得提前跟摄影师沟通好~文案已经帮你们准备好啦：最好的朋友就在身边，最爱的人就在眼前?・??想get同款，可以选择我们??@美悦盛宴婚礼艺术中心??广州-佛山-深圳线下均有门店??婚宴场地、摄影摄像、化妆主持团队，全程一条龙服务??资深婚礼策划师，1v1量身打造专属婚礼流程??震撼婚礼秀+婚前探店服务，提前现场体验??沉浸式宴会厅，可容纳4-42桌・评论区回复“1”，获取婚礼场地信息评论区回复“2”，获取婚礼价目表.
广州	2024/3/21	广州适合30/200人培训会议场地	https://www.xiaohongshu.com/explore/65f9669a00000000120223ab	做个地道珠海人	广东	"酒店会场：220/平（酒店总共16间会场）会场层高：3.5米（高）会场课桌：140/人会场剧院：200/人会场分组：150/人酒店客房：312/间会场：方正无柱，配备高清LED，适合美业/培训会/招商会 年会，答谢会，论坛，新品发布会酒店位置：酒店位于天河区中心，面向风光秀丽景色迷人的白云山。酒店采用法国著名 "" 凡尔赛 "" 艺术风格；宫殿式大堂，流光溢彩，极尽繁华尊贵，尽显皇者气派。酒店凯旋宫高 25 层 , 拥有大中小会议厅：国际厅、皇宫殿、太和殿、保和殿、皇廷1、皇廷2,共16间会议业务范围：专注全国会议酒店预订，场地预订，活动策划，灯光舞美，宴会订餐。#婚礼攻略 #真实婚礼 #活动布置 #婚礼 #会议场地 #会场 #广州酒店 #广州会场 #活动策划 #讲座 #招商会 #教育培训会"
亲 请看个签客服号呢	2024/3/20	广州户外花园婚礼现场	https://www.xiaohongshu.com/explore/65f9545a000000001203525e	V-valley003	广东	广州户外花园婚礼现场 幸福时刻#广州摄影基地 #广州影视基地 #广州新晋摄影基地 #广州摄影 #有爱的角落 #浪漫生活的记录者 #广州户外婚礼#花园 #广州户外婚礼场地
嘻嘻[偷笑R][飞吻R][飞吻R]	2024/3/22	春和景明 | 浪漫美好的瞬间传颂着春日意象	https://www.xiaohongshu.com/explore/65f94d4d00000000120379b8	广州汇爱婚礼	广东	「春和景明・四季有时」??春光作序借景于自然界美妙的造物让我们停下忙碌的脚步聆听耳畔传来的春和漫溯造访这片静谧的纯粹之境??轻纱幔落打造一场东方韵味的浪漫春日时分渐染的色彩鸢尾花与蝴蝶兰点缀其中叠嶂与繁花相映构筑唯美清新的东方美学之旅??婚礼策划：@广州汇爱婚礼活动场地：@广州四季酒店婚纱礼服：@SHINE MODA摄影团队：@StudioAbout摄影团队：@MaphiarPicture摄像团队：@GoldenLove婚礼影像主        持：@婚礼主持-大痣彩妆造型：@SEE-MAKEUP喜        饼：@荣华・嫁女直活动花艺：@Bloemen Huis#汇爱婚礼 #广州汇爱婚礼 #广州婚礼策划 #广州婚礼 #婚礼场地分享 #婚礼秀 #2024春季婚礼秀 #婚礼酒店 #中式美学 #东方美学 #宴会厅婚礼 #广州四季酒店婚礼秀
在楼梯上拍了吗[偷笑R]	2024/3/20	在广州像是住进了婚礼场地～	https://www.xiaohongshu.com/explore/65f9075c000000001203088d	晓时光与月	广东	??公主的下午茶要开动啦～…真的！这里很适合结芬，又有??又有咖啡??可以很适合和另外一半聊天??有小三层楼，还有旋转楼梯??复古感又带了点小清新，特别好拍，下次应该穿个拖尾婚纱来哈哈哈????和朋友点了个4寸巴斯克，蛋糕是低糖版的，糕体紧实。上面有超级多水果??没有任何果酱啊！！真的很难不喜欢????一大面面包墙，早餐也可以吃三文治和可颂，价格超级实惠呀??立马购入5件+??IN MOMENTS在场#婚礼场地 #氛围感餐厅 #cake #广州下午茶 #广州美食 #COTD咖啡探店 #周末去哪儿 #复古油画感裙子 #复古风拍照 #广州拍照 #广州早餐 #可颂面包 #可颂三文治
可精致啦[偷笑R][偷笑R]太好吃咯	2024/3/21	在广州像是住进了婚礼场地～	https://www.xiaohongshu.com/explore/65f9075c000000001203088d	晓时光与月	广东	??公主的下午茶要开动啦～…真的！这里很适合结芬，又有??又有咖啡??可以很适合和另外一半聊天??有小三层楼，还有旋转楼梯??复古感又带了点小清新，特别好拍，下次应该穿个拖尾婚纱来哈哈哈????和朋友点了个4寸巴斯克，蛋糕是低糖版的，糕体紧实。上面有超级多水果??没有任何果酱啊！！真的很难不喜欢????一大面面包墙，早餐也可以吃三文治和可颂，价格超级实惠呀??立马购入5件+??IN MOMENTS在场#婚礼场地 #氛围感餐厅 #cake #广州下午茶 #广州美食 #COTD咖啡探店 #周末去哪儿 #复古油画感裙子 #复古风拍照 #广州拍照 #广州早餐 #可颂面包 #可颂三文治
本场策划老师欢迎欢迎[派对R][派对R][派对R]	2024/3/24	你我之间 放过最美的烟花	https://www.xiaohongshu.com/explore/65f8cf7d00000000120215f0	一粒米	广东	我们会在婚礼的晚宴上，放属于我们的烟花。烟花绽放的刹那，极其绚烂，但其实它很快会消失，所以才要和你一起看。即便记忆消退，忘记烟花什么样子，不知道升空的烟火是扁还是圆，不记得他的形状和颜色，可那又有什么关系呢，我会永远记得在我们婚礼上，一起看烟花的那个夜晚。策划：@几立婚礼场地：@郑州禧柿小院化妆：@DIDI Makeup Studio服装：@CANAAN ATELIER迦南婚纱西服：@MeiSheng制衣主持：@姜・文婚礼主持工作室客服灯光：@天青舞美郭帅#郑州婚礼#婚礼晚宴 #婚礼跟拍 #郑州婚礼跟拍 #洛阳婚礼跟拍 #西安婚礼跟拍 #上海婚礼跟拍 #广州婚礼跟拍 #成都婚礼跟拍 #杭州婚礼跟拍 #长沙婚礼跟拍 #南京婚礼跟拍 #武汉婚礼跟拍 #厦门婚礼跟拍 #北京婚礼跟拍 #重庆婚礼跟拍 #连云港婚礼跟拍
可以??	2024/3/23	佛山|人均120+实现高级感满满的团建自助餐	https://www.xiaohongshu.com/explore/65faa9020000000014006e92	翌喜餐饮到烩	广东	大家出去团建????是不是都很惆怅吃什么呢??100人的自助餐，更加是众口难调??想要多样性??，还要味道??有保障？那么??自助餐上门的形式，是一个不错的选择！客户定了场地??，但是场地不包餐食??，所以找到了我们??，希望我们能够提供一场100人的自助餐！??通过沟通，确定了年会的主题是港风，颜色以红色??为主，??我们搭配了黑色的就餐桌布和红色的桌旗和台花??，??枣红色的取餐桌布搭配复古港风的摆件和花艺装饰。??关于我们的餐食<主菜主食>中式粤菜??，西式煎扒??，海鲜菜品??，健康蔬菜??，东南亚菜式??等等??各种菜式，不再担心重口难调的问题，??每个人都能找到自己喜欢吃的，??特殊口味，也能特殊调整，简直不要太贴心。<甜点>??各类甜点，目不暇接，??多种口味，让甜点脑袋垂涎欲滴。<冷盘小吃>??中式糕点，健康沙拉??，美味汉堡??，新鲜刺身??，日式寿司??等等??食材新鲜，每样都色香味俱全，让人回味无穷。??想要了解更多活动餐饮定制????可以后台滴滴小翌+人数+类型????我是翌喜，总带给你下一个喜悦??#自助餐上门#广州自助餐上门#佛山自助餐上门#高端茶歇#活动茶歇#活动自助餐#餐饮到烩#翌喜餐饮到烩?#茶歇甜品台#商务茶歇#企业茶歇#茶歇冷餐#开业茶歇#公司开业茶歇#婚礼茶歇#酒会活动茶歇#乔迁茶歇#主题团建#商务茶歇#茶歇定制#企业下午茶茶歇#广州茶歇#团建推荐
[萌萌哒R][萌萌哒R]	2024/3/22	光是氛围感的来源｜江门婚礼跟拍｜撒落的阳光	https://www.xiaohongshu.com/explore/65fd9880000000001203cf09	??清水	广东	男方家在新会泮月居定的客房可以到泳池边拍照哈，阳光撒落下来氛围感拉满，而且酒店工作人员也很热心哈化妆：@乐禧新娘小蜜（看置顶）摄影：@Venhy梵希影像（看置顶）场地：@泮月居民宿
[飞吻R][飞吻R]	2024/3/25	穿越时空・中式婚礼传承之美｜佛山婚宴酒店	https://www.xiaohongshu.com/explore/65fd3d640000000012023466	佛山花开嫁日艺术婚礼中心	广东	??回复【1】获取价格??回复【2】了解同款??回复【3】查看地址-??婚礼主题：大明宫宴??宴 会 厅：中式厅??婚礼坐标：@佛山花开嫁日艺术婚礼中心-三书六礼，凤冠霞帔十里红妆，明媒正娶朝暮与年岁并往??与你携手共度余生中式婚礼太震撼了??-气势恢宏的传统中式婚礼采用中式古典建筑的美感宫灯摇曳??云雾渲染喜庆气氛-宫阙亭台 庄重大方雕龙画凤 栩栩如生每一处都匠心独具??也有着满满的好寓意瞬间给人带来沉浸感??-??了解价格|活动|风格|地址??小编在线，随时为您解答！/佛山婚宴酒店|佛山婚礼堂|佛山婚礼酒店佛山一站式婚礼|佛山婚礼|佛山婚礼策划一站式婚礼|婚礼堂|佛山备婚|婚礼酒店#佛山婚礼 #佛山备婚 #佛山同城 #婚礼场地分享 #佛山婚礼布置 #佛山婚礼堂 #婚礼堂 #婚礼堂酒店 #一站式婚礼 #一站式婚礼服务 #婚礼现场 #婚宴#婚宴酒店 #中式婚礼 #明式婚礼 #国风婚礼
真的很赞	2024/3/22		https://www.xiaohongshu.com/explore/65fd282300000000120205ef	大西瓜??_57985341	广东	婚礼结束啦【秀婚Y合作F】婚Y策划 | 找我婚礼z影F | 暮光映像z像F | OT vision新娘化y | IRIS MAKEUP-KK新郎化y | IRIS MAKEUP-JJ婚Y司x | 缘程古风社创始人恒缘婚礼执礼|缘程古风社首席执礼喜娘小美婚Y服 | 侨恩定制/淳刍樯茨惺课鞣 |侨恩定制/淳刍樯醇从凹从 | 质铝匍T蓝天摄影设宴场地 |佛山名都雍景湾大酒楼这次结婚真的超出预想 没想到效果能好成这样 找好婚礼策划师真的非常非常重要～老公无意间在抖音都到了找我婚礼 @找我婚礼广州店 太古汇地铁口隆德大厦那一家！！前期招待的是个超级暖男维维 一开始非常认真的沟通 我们喜欢的风格 或者是有没有特别需要添加的元素 沟通好前期之后 派给我一个超级顶的策划师金鱼@婚礼策划师-Chloe金鱼?? 整个婚礼都是她去串联 想法非常多 一直有想法就告诉我们 我们改了几次 帮我们压低了许多预算 你们可以看看我的婚礼布置 真的很好看很大气 传统中式比西式大气很多 维维推荐的暮光摄影ot摄像都特别赞 @暮光映画摄影工作室 @Outstanding Vision 婚礼结束摄影出图很快不说 超级好看啊 每个人都问我摄影是什么机构 丸子@丸子 兔纸@兔子 顶顶顶 真的拍得很好看 摄像也很赞 @（摄像剪辑）安妮??禁言中 本人胖 拍的我好好看 化妆师超级给力@IrisMakeup 女家@Iris Makeup kk 男家@Iris Makeup jj 都很好看 看到我的人都说我超级美 kk的妆一点不怎么掉 头饰帮我做的特别好 妆容好绝 主持老师也很赞 非常专业 古风口音也很赞@资深中英双语主持人恒缘 2位喜娘@中式婚礼司仪小美 也是不厌其烦教我们怎么去做 整个婚礼真的没有一点遗憾 物超所值 什么都值得了 朋友圈被我们的婚礼刷爆了 因为我是比较佛系的新娘 所以很多方面给不到太多时间工作人员 工作人员们操心啦 感恩遇见所有工作人员??给了我非常完整的婚礼
你的妆完美	2024/3/23		https://www.xiaohongshu.com/explore/65fd282300000000120205ef	大西瓜??_57985341	广东	婚礼结束啦【秀婚Y合作F】婚Y策划 | 找我婚礼z影F | 暮光映像z像F | OT vision新娘化y | IRIS MAKEUP-KK新郎化y | IRIS MAKEUP-JJ婚Y司x | 缘程古风社创始人恒缘婚礼执礼|缘程古风社首席执礼喜娘小美婚Y服 | 侨恩定制/淳刍樯茨惺课鞣 |侨恩定制/淳刍樯醇从凹从 | 质铝匍T蓝天摄影设宴场地 |佛山名都雍景湾大酒楼这次结婚真的超出预想 没想到效果能好成这样 找好婚礼策划师真的非常非常重要～老公无意间在抖音都到了找我婚礼 @找我婚礼广州店 太古汇地铁口隆德大厦那一家！！前期招待的是个超级暖男维维 一开始非常认真的沟通 我们喜欢的风格 或者是有没有特别需要添加的元素 沟通好前期之后 派给我一个超级顶的策划师金鱼@婚礼策划师-Chloe金鱼?? 整个婚礼都是她去串联 想法非常多 一直有想法就告诉我们 我们改了几次 帮我们压低了许多预算 你们可以看看我的婚礼布置 真的很好看很大气 传统中式比西式大气很多 维维推荐的暮光摄影ot摄像都特别赞 @暮光映画摄影工作室 @Outstanding Vision 婚礼结束摄影出图很快不说 超级好看啊 每个人都问我摄影是什么机构 丸子@丸子 兔纸@兔子 顶顶顶 真的拍得很好看 摄像也很赞 @（摄像剪辑）安妮??禁言中 本人胖 拍的我好好看 化妆师超级给力@IrisMakeup 女家@Iris Makeup kk 男家@Iris Makeup jj 都很好看 看到我的人都说我超级美 kk的妆一点不怎么掉 头饰帮我做的特别好 妆容好绝 主持老师也很赞 非常专业 古风口音也很赞@资深中英双语主持人恒缘 2位喜娘@中式婚礼司仪小美 也是不厌其烦教我们怎么去做 整个婚礼真的没有一点遗憾 物超所值 什么都值得了 朋友圈被我们的婚礼刷爆了 因为我是比较佛系的新娘 所以很多方面给不到太多时间工作人员 工作人员们操心啦 感恩遇见所有工作人员??给了我非常完整的婚礼
谢谢	2024/3/22		https://www.xiaohongshu.com/explore/65fd282300000000120205ef	大西瓜??_57985341	广东	婚礼结束啦【秀婚Y合作F】婚Y策划 | 找我婚礼z影F | 暮光映像z像F | OT vision新娘化y | IRIS MAKEUP-KK新郎化y | IRIS MAKEUP-JJ婚Y司x | 缘程古风社创始人恒缘婚礼执礼|缘程古风社首席执礼喜娘小美婚Y服 | 侨恩定制/淳刍樯茨惺课鞣 |侨恩定制/淳刍樯醇从凹从 | 质铝匍T蓝天摄影设宴场地 |佛山名都雍景湾大酒楼这次结婚真的超出预想 没想到效果能好成这样 找好婚礼策划师真的非常非常重要～老公无意间在抖音都到了找我婚礼 @找我婚礼广州店 太古汇地铁口隆德大厦那一家！！前期招待的是个超级暖男维维 一开始非常认真的沟通 我们喜欢的风格 或者是有没有特别需要添加的元素 沟通好前期之后 派给我一个超级顶的策划师金鱼@婚礼策划师-Chloe金鱼?? 整个婚礼都是她去串联 想法非常多 一直有想法就告诉我们 我们改了几次 帮我们压低了许多预算 你们可以看看我的婚礼布置 真的很好看很大气 传统中式比西式大气很多 维维推荐的暮光摄影ot摄像都特别赞 @暮光映画摄影工作室 @Outstanding Vision 婚礼结束摄影出图很快不说 超级好看啊 每个人都问我摄影是什么机构 丸子@丸子 兔纸@兔子 顶顶顶 真的拍得很好看 摄像也很赞 @（摄像剪辑）安妮??禁言中 本人胖 拍的我好好看 化妆师超级给力@IrisMakeup 女家@Iris Makeup kk 男家@Iris Makeup jj 都很好看 看到我的人都说我超级美 kk的妆一点不怎么掉 头饰帮我做的特别好 妆容好绝 主持老师也很赞 非常专业 古风口音也很赞@资深中英双语主持人恒缘 2位喜娘@中式婚礼司仪小美 也是不厌其烦教我们怎么去做 整个婚礼真的没有一点遗憾 物超所值 什么都值得了 朋友圈被我们的婚礼刷爆了 因为我是比较佛系的新娘 所以很多方面给不到太多时间工作人员 工作人员们操心啦 感恩遇见所有工作人员??给了我非常完整的婚礼
谢谢你	2024/3/22		https://www.xiaohongshu.com/explore/65fd282300000000120205ef	大西瓜??_57985341	广东	婚礼结束啦【秀婚Y合作F】婚Y策划 | 找我婚礼z影F | 暮光映像z像F | OT vision新娘化y | IRIS MAKEUP-KK新郎化y | IRIS MAKEUP-JJ婚Y司x | 缘程古风社创始人恒缘婚礼执礼|缘程古风社首席执礼喜娘小美婚Y服 | 侨恩定制/淳刍樯茨惺课鞣 |侨恩定制/淳刍樯醇从凹从 | 质铝匍T蓝天摄影设宴场地 |佛山名都雍景湾大酒楼这次结婚真的超出预想 没想到效果能好成这样 找好婚礼策划师真的非常非常重要～老公无意间在抖音都到了找我婚礼 @找我婚礼广州店 太古汇地铁口隆德大厦那一家！！前期招待的是个超级暖男维维 一开始非常认真的沟通 我们喜欢的风格 或者是有没有特别需要添加的元素 沟通好前期之后 派给我一个超级顶的策划师金鱼@婚礼策划师-Chloe金鱼?? 整个婚礼都是她去串联 想法非常多 一直有想法就告诉我们 我们改了几次 帮我们压低了许多预算 你们可以看看我的婚礼布置 真的很好看很大气 传统中式比西式大气很多 维维推荐的暮光摄影ot摄像都特别赞 @暮光映画摄影工作室 @Outstanding Vision 婚礼结束摄影出图很快不说 超级好看啊 每个人都问我摄影是什么机构 丸子@丸子 兔纸@兔子 顶顶顶 真的拍得很好看 摄像也很赞 @（摄像剪辑）安妮??禁言中 本人胖 拍的我好好看 化妆师超级给力@IrisMakeup 女家@Iris Makeup kk 男家@Iris Makeup jj 都很好看 看到我的人都说我超级美 kk的妆一点不怎么掉 头饰帮我做的特别好 妆容好绝 主持老师也很赞 非常专业 古风口音也很赞@资深中英双语主持人恒缘 2位喜娘@中式婚礼司仪小美 也是不厌其烦教我们怎么去做 整个婚礼真的没有一点遗憾 物超所值 什么都值得了 朋友圈被我们的婚礼刷爆了 因为我是比较佛系的新娘 所以很多方面给不到太多时间工作人员 工作人员们操心啦 感恩遇见所有工作人员??给了我非常完整的婚礼
谢谢哈哈哈[萌萌哒R][萌萌哒R][萌萌哒R]	2024/3/23	佛山花艺装置｜捕捉Fafa的美丽????	https://www.xiaohongshu.com/explore/65fd118d000000001203d280	大雄_婚Y策划	广东	春天里的每个大自然怎么少得了瀑布的Fafa用一朵朵春天色系的花瓣编制了春日瀑布????Planning 婚Y策划 /@Three婚礼设计策划Venue  布置场地 / @四季艺术汇
绝美了好吗！！！[抓狂R]	2024/3/22	我劲正佛山四大金刚团队	https://www.xiaohongshu.com/explore/65fbd4cb0000000014006416	Chloe	广东	婚礼过去差唔多一个月了，筹备婚礼一年，就系为左约齐我心目中最想订团队[耶R]化妆造型 感谢yuna~比我做左一日公主@DIDO MAKEUP-Yuna禁言中 @DIDO MAKEUP-化妆师Eva摄影 暮光丸子同良哥总会get到我想要S，距地话“只要你做自己，其他S交比我”@丸子 @UMG暮光艮叔 @暮光映画摄影工作室EVAH婚纱 当我一黎试纱，我就知道我走唔到噶了，巨重工，巨靓，完成我个公主梦@EVAH婚纱礼服摄像 我表情管理得唔好，但系你地捉拍得好好，仲帮我拍左个好写实花絮@川~映画主持 感谢一飞哥哥精彩主持~等我O两个社恐人可以出少两句声，督导姐姐服务周到，全程照顾我@主持??一飞策划 我O场地细，预算少，但系由头到尾不厌其烦帮我地改设计，帮我地做安排，现场真系好靓好满意@一喜婚礼定制―――――――――――――――――――感谢甘多位工作人员，辛苦大家！无你地，我地个婚礼都无钔昝~我将疃辔怀浦为史上最fit团队，婚礼结束，好多亲戚朋友都赞爆你地[红色心形R][红色心形R]
[红色心形R][红色心形R]朵谢你地啊	2024/3/21	我劲正佛山四大金刚团队	https://www.xiaohongshu.com/explore/65fbd4cb0000000014006416	Chloe	广东	婚礼过去差唔多一个月了，筹备婚礼一年，就系为左约齐我心目中最想订团队[耶R]化妆造型 感谢yuna~比我做左一日公主@DIDO MAKEUP-Yuna禁言中 @DIDO MAKEUP-化妆师Eva摄影 暮光丸子同良哥总会get到我想要S，距地话“只要你做自己，其他S交比我”@丸子 @UMG暮光艮叔 @暮光映画摄影工作室EVAH婚纱 当我一黎试纱，我就知道我走唔到噶了，巨重工，巨靓，完成我个公主梦@EVAH婚纱礼服摄像 我表情管理得唔好，但系你地捉拍得好好，仲帮我拍左个好写实花絮@川~映画主持 感谢一飞哥哥精彩主持~等我O两个社恐人可以出少两句声，督导姐姐服务周到，全程照顾我@主持??一飞策划 我O场地细，预算少，但系由头到尾不厌其烦帮我地改设计，帮我地做安排，现场真系好靓好满意@一喜婚礼定制―――――――――――――――――――感谢甘多位工作人员，辛苦大家！无你地，我地个婚礼都无钔昝~我将疃辔怀浦为史上最fit团队，婚礼结束，好多亲戚朋友都赞爆你地[红色心形R][红色心形R]
